{
  "$schema": "https://json-schema.org/draft/2020-12/schema",
  "$id": "https://versionless-navy.vercel.app/schemas/versionless-v1.json",
  "title": "Versionless pull request policy",
  "description": "Defines the proof an agent must preserve before a pull request can be verified.",
  "type": "object",
  "additionalProperties": false,
  "required": ["version", "lockedPaths", "allowedPaths", "verification"],
  "properties": {
    "$schema": {
      "type": "string"
    },
    "version": {
      "const": 1
    },
    "lockedPaths": {
      "type": "array",
      "minItems": 1,
      "maxItems": 64,
      "uniqueItems": true,
      "items": {
        "$ref": "#/$defs/repositoryPath"
      }
    },
    "allowedPaths": {
      "type": "array",
      "minItems": 1,
      "maxItems": 64,
      "uniqueItems": true,
      "items": {
        "$ref": "#/$defs/repositoryPath"
      }
    },
    "workingDirectory": {
      "allOf": [
        { "$ref": "#/$defs/repositoryPath" }
      ],
      "default": "."
    },
    "verification": {
      "type": "object",
      "additionalProperties": false,
      "required": ["executable", "args"],
      "properties": {
        "executable": {
          "type": "string",
          "minLength": 1,
          "maxLength": 240,
          "pattern": "^[A-Za-z0-9_./+-]+$"
        },
        "args": {
          "type": "array",
          "maxItems": 32,
          "items": {
            "type": "string",
            "maxLength": 500
          }
        }
      }
    }
  },
  "$defs": {
    "repositoryPath": {
      "type": "string",
      "minLength": 1,
      "maxLength": 300,
      "pattern": "^(?!/)(?!.*(?:^|/)\\.\\.(?:/|$))(?!\\.git(?:/|$)).+$"
    }
  }
}
